{
  "contractVersion": "4.0",
  "contentSnapshotId": "CS-20260624-0001",
  "sourceDigest": "a1b2c3d4e5f6a1b2c3d4e5f6a1b2c3d4e5f6a1b2c3d4e5f6a1b2c3d4e5f6a1b2",
  "approvedAt": "2026-06-24T10:00:00Z",
  "userDecision": "approved",
  "sources": {
    "contentMasterDraft": "fixtures/valid/complete-v4-content-master.json",
    "beatSheet": "fixtures/valid/complete-v4-beat-sheet.json",
    "contentSegmentPlan": "fixtures/valid/content-segment-plan.json",
    "scopeContract": "fixtures/valid/scope-contract.json",
    "evidenceNotes": "fixtures/valid/evidence-notes.json",
    "topicDecision": "fixtures/valid/topic-decision.json"
  }
}
